{
  "id": "com.seagull.usage-cost",
  "kind": "plugin",
  "name": {
    "default": "Usage Cost",
    "zh-CN": "成本核算看板"
  },
  "description": {
    "default": "Estimate API usage cost from usage statistics with built-in / OpenRouter-synced per-model prices, daily cost chart and CSV export.",
    "zh-CN": "读取使用量统计，按内置官方刊例/OpenRouter 换算单价估算各模型 API 使用成本，支持每日成本条形图与 CSV 导出，可一键从 OpenRouter 同步价格。"
  },
  "repo": "https://github.com/xb0or/snow-plugins",
  "version": "1.2.2",
  "tag": "usage-cost/v1.2.2",
  "asset": "com.seagull.usage-cost-1.2.2.zip",
  "sha256": "d39d8c35bbb09cdb38795e4f8dd9a7563659981fd2cfa676d70da3330c89e32c",
  "author": "kedou",
  "privacy": [
    "usage"
  ],
  "tags": [
    "usage",
    "cost",
    "dashboard",
    "openrouter"
  ],
  "icon": "lucide:CircleDollarSign"
}
