{
  "id": "com.snow.session-file-count",
  "kind": "plugin",
  "name": {
    "default": "Session File Count",
    "zh-CN": "会话文件统计",
    "zh-TW": "會話檔案統計"
  },
  "description": {
    "default": "Show recorded conversation files below the latest completed reply, including sub-agents. Requires the new host footer and tracking APIs.",
    "zh-CN": "在最新已结束回复下方展示当前会话及子代理已记录文件数量与清单。需要新版宿主回复插槽与追踪接口。",
    "zh-TW": "在最新已結束回覆下方顯示目前會話及子代理已記錄檔案數量與清單。需要新版宿主回覆插槽與追蹤介面。"
  },
  "author": "小青枣 & Snow App contributors",
  "repo": "https://github.com/BaSui01/snow-plugins",
  "homepage": "https://github.com/BaSui01/snow-plugins/tree/main/plugins/session-file-count",
  "version": "1.1.7",
  "tag": "session-file-count/v1.1.7",
  "asset": "session-file-count-1.1.7.zip",
  "downloadUrl": "https://github.com/BaSui01/snow-plugins/releases/download/session-file-count%2Fv1.1.7/session-file-count-1.1.7.zip",
  "sha256": "50d5ebd9a86523950fa868d55f02b53b6f3b4217778115be2ea72fb6604ab641",
  "privacy": [],
  "tags": [
    "会话",
    "文件统计",
    "回复"
  ],
  "icon": "lucide:Files",
  "minAppVersion": "0.4.16"
}
