{
  "id": "com.seagull.stt-launcher",
  "kind": "plugin",
  "name": {
    "default": "Local Speech Service",
    "zh-CN": "本地语音服务"
  },
  "description": {
    "default": "Start / stop / restart the local whisper.cpp transcription service and manage its models (multi-backend CUDA / Vulkan / CPU). Zero-config: stt_server.py ships with the plugin, the CPU whisper runtime auto-downloads on first start, and models download from the built-in library. Must be used together with the \"Local Speech Service\" client script: this panel only runs the service and provides no voice input by itself.",
    "zh-CN": "启动 / 停止 / 重启本地 whisper.cpp 转写服务并管理识别模型，支持 CUDA / Vulkan / CPU 多后端自动择优。零配置：stt_server.py 随插件自带，服务目录留空自动定位，首次启动自动下载 CPU 运行时，模型在面板模型库下载，还可一键让 AI 帮装 GPU 后端。需与「本地语音服务」客户端脚本配合使用：本面板只负责起服务，本身不提供语音输入。"
  },
  "repo": "https://github.com/xb0or/snow-plugins",
  "version": "1.5.0",
  "tag": "stt-launcher/v1.5.0",
  "asset": "com.seagull.stt-launcher-1.5.0.zip",
  "sha256": "b7316d9a2578edf43656011e22564ce45de2a32e2f5014b2860cfdccca3c6d57",
  "author": "kedou",
  "privacy": [
    "terminal"
  ],
  "tags": [
    "voice",
    "speech",
    "whisper",
    "stt",
    "local",
    "cuda",
    "vulkan"
  ],
  "icon": "lucide:AudioWaveform"
}
