{
  "id": "com.seagull.tps-metrics",
  "kind": "plugin",
  "name": {
    "default": "Mission Control",
    "zh-CN": "任务中心"
  },
  "description": {
    "default": "Industry-convention TPS/TTFT metrics plus a live overview of all running sessions (including sub-agents).",
    "zh-CN": "按行业口径计算 TPS/TTFT，并汇总全部运行中会话（含子代理）的实时状态。"
  },
  "repo": "https://github.com/xb0or/snow-plugins",
  "version": "0.2.1",
  "tag": "tps-metrics/v0.2.1",
  "asset": "com.seagull.tps-metrics-0.2.1.zip",
  "sha256": "660e05901048d37b88a58508d65878c045ee22a98ba327ea83a6f4ac911ba0bc",
  "author": "kedou",
  "privacy": ["conversations"],
  "tags": ["metrics", "monitor", "tps", "ttft"],
  "icon": "lucide:Activity"
}
