{
  "id": "com.github.xqchencn.snow-file-explorer",
  "kind": "plugin",
  "name": {
    "default": "File Explorer",
    "zh-CN": "文件浏览器",
    "zh-TW": "檔案瀏覽器"
  },
  "description": {
    "default": "Browse local workspace with file preview, Markdown preview, Git status, REST request sending, terminal and project command running.",
    "zh-CN": "本地工作区文件浏览器，支持代码与 Markdown 预览、Git 状态、REST 请求发送、交互式终端和项目命令运行。",
    "zh-TW": "本機工作區檔案瀏覽器，支援程式碼與 Markdown 預覽、Git 狀態、REST 請求送出、互動式終端機與專案命令執行。"
  },
  "author": "xqchen",
  "repo": "https://github.com/xqchencn/snow-file-explorer",
  "homepage": "https://github.com/xqchencn/snow-file-explorer",
  "version": "1.1.3",
  "tag": "v1.1.3",
  "asset": "snow-file-explorer-v1.1.3.zip",
  "sha256": "769ab2d8371e396876f4a6d3d7fe810b3bc529512816ba2b0b15a1ca635d5caa",
  "privacy": [
    "filesystem",
    "terminal",
    "conversations",
    "network"
  ],
  "tags": [
    "file-explorer",
    "workspace",
    "git",
    "http",
    "rest",
    "terminal",
    "run-config"
  ],
  "icon": "lucide:FolderTree"
}
