{
  "id": "com.seagull.skill-store",
  "kind": "plugin",
  "name": {
    "default": "Skill Store",
    "zh-CN": "技能商店"
  },
  "description": {
    "default": "Browse and install community agent skills from aggregated public indexes (official / local / community sources / skills.sh), with search, collapsible category filters, paged list, global or project install location, one-click or AI-assisted install.",
    "zh-CN": "聚合公开技能索引（官方技能 / 本地技能 / 社区源 / skills.sh），支持搜索、分类折叠过滤、分页浏览、全局或项目级一键安装或让 AI 代装；skills.sh 卡片描述自动从详情页补齐。"
  },
  "repo": "https://github.com/xb0or/snow-plugins",
  "version": "1.2.1",
  "tag": "skill-store/v1.2.1",
  "asset": "com.seagull.skill-store-1.2.1.zip",
  "sha256": "2bca50dc2644f68ae9d183f11f477f111bd0df3e4089e5587bff498139fd4183",
  "author": "kedou",
  "privacy": ["network"],
  "tags": ["skills", "store", "directory", "installer", "skills-sh"],
  "icon": "lucide:Store"
}
